{
  "schema_version": 1,
  "status": "accepted",
  "unresolved_findings": 0,
  "fixture_sha256": "470f4382d6cc81e60e5a0511d1d3987dbd2534e3e6880843a3e73f00c7c83f45",
  "gold_sha256": "2795b4afc4dd58c29ba17455bab9edc980ddd448d3dd453dc3de7beb1905be68",
  "mechanical_contract_sha256": "96b9bcfdf12c4654243c2e57f54cba8fdbf6ae21d644849282aa9a57bf9c8877",
  "semantic_guidance_sha256": "a3ceb608bc9d336cc0dd1d611f1294063f58f86cd651cf7e421a596510f6795e",
  "sealed_review_receipt_sha256": "d2f28eb7f85426070140285a965d6bb6dcf3425a1204de50ba10e3acbe28ac90",
  "independence_attestation": "independent_author_inputs_only_no_product_prior_inputs_answers_or_grades",
  "coverage": {
    "questions": 96,
    "required_facts": 210,
    "all_questions_reviewed": true,
    "all_required_facts_reviewed": true,
    "negative_cases_reviewed": true
  }
}
