{
  "schema_version": 1,
  "status": "changes_required",
  "unresolved_findings": 5,
  "fixture_sha256": "d7b683b5427130658ed21d89075b7d0f16db34e988c487b1ae7adb34c126a461",
  "gold_sha256": "88f5d5371635f5b1f260fb9e08fdf59506f61d2698aa119c85bd0d7ea0548bed",
  "mechanical_contract_sha256": "96b9bcfdf12c4654243c2e57f54cba8fdbf6ae21d644849282aa9a57bf9c8877",
  "semantic_guidance_sha256": "a3ceb608bc9d336cc0dd1d611f1294063f58f86cd651cf7e421a596510f6795e",
  "sealed_review_receipt_sha256": "e50cb458300dc336d4336b7b2c3433f1bfc1ef03b21fce8c2f9105da6c4cbcd1",
  "independence_attestation": "independent_author_inputs_only_no_product_prior_inputs_answers_or_grades",
  "coverage": {
    "questions": 96,
    "required_facts": 123,
    "all_questions_reviewed": true,
    "all_required_facts_reviewed": true,
    "negative_cases_reviewed": true
  }
}
